{
  "schemaVersion": 1,
  "lessonId": "M01-L004",
  "sourceDeck": "M01-L004-deck-source.json",
  "layoutContract": "course/layout-contracts/canva/l001-reference-v1.json",
  "theme": {
    "thaiFont": "Sarabun",
    "latinFont": "Sarabun",
    "backgroundColor": "#F5F7F8",
    "rightZoneTint": "#DBE7EC",
    "accentColors": [
      "#355C7D",
      "#7A8F54",
      "#C96F4A"
    ]
  },
  "slides": [
    {
      "id": "canva-slide-01",
      "title": "Numbers 0 to 10",
      "layoutFamily": "opener",
      "backgroundPath": "canva-backgrounds/slide-01.png",
      "elements": [
        {
          "id": "eyebrow",
          "kind": "text",
          "x": 731520,
          "y": 1645920,
          "w": 6858000,
          "h": 365760,
          "fontName": "Sarabun",
          "fontSizePt": 12,
          "color": "#355C7D",
          "bold": true,
          "italic": false,
          "align": "left",
          "value": "First Contact and Courtesy  ·  A0"
        },
        {
          "id": "lesson_id",
          "kind": "text",
          "x": 731520,
          "y": 2103120,
          "w": 6858000,
          "h": 457200,
          "fontName": "Sarabun",
          "fontSizePt": 19,
          "color": "#566873",
          "bold": false,
          "italic": false,
          "align": "left",
          "value": "M01-L004"
        },
        {
          "id": "title",
          "kind": "text",
          "x": 731520,
          "y": 2651760,
          "w": 6858000,
          "h": 914400,
          "fontName": "Sarabun",
          "fontSizePt": 38,
          "color": "#24333D",
          "bold": true,
          "italic": false,
          "align": "left",
          "value": "Numbers 0 to 10"
        },
        {
          "id": "brand",
          "kind": "text",
          "x": 731520,
          "y": 5303520,
          "w": 6858000,
          "h": 365760,
          "fontName": "Sarabun",
          "fontSizePt": 15,
          "color": "#566873",
          "bold": false,
          "italic": false,
          "align": "left",
          "value": "Immersion Thai with Nine"
        }
      ]
    },
    {
      "id": "canva-slide-02",
      "title": "What you will learn",
      "layoutFamily": "objectives-list",
      "backgroundPath": "canva-backgrounds/slide-02.png",
      "elements": [
        {
          "id": "title",
          "kind": "text",
          "x": 731520,
          "y": 1061443,
          "w": 6858000,
          "h": 457200,
          "fontName": "Sarabun",
          "fontSizePt": 30,
          "color": "#24333D",
          "bold": true,
          "italic": false,
          "align": "left",
          "value": "What you will learn"
        },
        {
          "id": "objective_1",
          "kind": "text",
          "x": 1280047,
          "y": 1964720,
          "w": 6217800,
          "h": 457200,
          "fontName": "Sarabun",
          "fontSizePt": 16,
          "color": "#24333D",
          "bold": false,
          "italic": false,
          "align": "left",
          "value": "1. You can understand and say the digits needed for age, room numbers, and basic counting."
        },
        {
          "id": "objective_2",
          "kind": "text",
          "x": 1280047,
          "y": 2649225,
          "w": 6217800,
          "h": 457200,
          "fontName": "Sarabun",
          "fontSizePt": 16,
          "color": "#24333D",
          "bold": false,
          "italic": false,
          "align": "left",
          "value": "2. You can recycle recent vocabulary while using number pronunciation control in short controlled output."
        },
        {
          "id": "objective_3",
          "kind": "text",
          "x": 1280047,
          "y": 3333730,
          "w": 6217800,
          "h": 457200,
          "fontName": "Sarabun",
          "fontSizePt": 16,
          "color": "#24333D",
          "bold": false,
          "italic": false,
          "align": "left",
          "value": "3. Say your age, count objects, and give a simple number clearly."
        },
        {
          "id": "objective_4",
          "kind": "text",
          "x": 1280160,
          "y": 4018260,
          "w": 6217800,
          "h": 457200,
          "fontName": "Sarabun",
          "fontSizePt": 16,
          "color": "#24333D",
          "bold": false,
          "italic": false,
          "align": "left",
          "value": "4. Recognize slowly spoken digits in age and number contexts."
        }
      ]
    },
    {
      "id": "canva-slide-03",
      "title": "Digits 0 to 5",
      "layoutFamily": "single-focus-card",
      "backgroundPath": "canva-backgrounds/slide-03.png",
      "elements": [
        {
          "id": "section_label",
          "kind": "text",
          "x": 731527,
          "y": 1719200,
          "w": 1210500,
          "h": 320100,
          "fontName": "Sarabun",
          "fontSizePt": 12,
          "color": "#FFFFFF",
          "bold": true,
          "italic": false,
          "align": "center",
          "value": "Section 1"
        },
        {
          "id": "title",
          "kind": "text",
          "x": 2063268,
          "y": 1582106,
          "w": 5943600,
          "h": 457200,
          "fontName": "Sarabun",
          "fontSizePt": 30,
          "color": "#24333D",
          "bold": true,
          "italic": false,
          "align": "left",
          "value": "Digits 0 to 5"
        },
        {
          "id": "thai",
          "kind": "text",
          "x": 1142988.0,
          "y": 2332605.0,
          "w": 5303400.0,
          "h": 1042060.0,
          "fontName": "Sarabun",
          "fontSizePt": 32,
          "color": "#24333D",
          "bold": true,
          "italic": false,
          "align": "left",
          "value": "ศูนย์ (sǔun)",
          "segments": [
            {
              "text": "ศูนย์",
              "fontName": "Sarabun",
              "fontSizePt": 32.0,
              "color": "#24333D",
              "bold": true,
              "italic": false
            },
            {
              "text": " (sǔun)",
              "fontName": "Sarabun",
              "fontSizePt": 19.8,
              "color": "#566873",
              "bold": false,
              "italic": true
            }
          ]
        },
        {
          "id": "english",
          "kind": "text",
          "x": 1143000,
          "y": 3374675,
          "w": 5303400,
          "h": 365700,
          "fontName": "Sarabun",
          "fontSizePt": 15,
          "color": "#82909A",
          "bold": false,
          "italic": false,
          "align": "left",
          "value": "zero"
        },
        {
          "id": "note",
          "kind": "text",
          "x": 731520,
          "y": 4142240,
          "w": 6858000,
          "h": 914400,
          "fontName": "Sarabun",
          "fontSizePt": 16,
          "color": "#24333D",
          "bold": false,
          "italic": false,
          "align": "left",
          "value": "ศูนย์ | sǔun | 0 — zero\nหนึ่ง | nùeng | 1 — one"
        }
      ]
    },
    {
      "id": "canva-slide-04",
      "title": "Digits 6 to 10",
      "layoutFamily": "single-focus-card",
      "backgroundPath": "canva-backgrounds/slide-04.png",
      "elements": [
        {
          "id": "section_label",
          "kind": "text",
          "x": 731527,
          "y": 1719200,
          "w": 1210500,
          "h": 320100,
          "fontName": "Sarabun",
          "fontSizePt": 12,
          "color": "#FFFFFF",
          "bold": true,
          "italic": false,
          "align": "center",
          "value": "Section 2"
        },
        {
          "id": "title",
          "kind": "text",
          "x": 2063268,
          "y": 1582106,
          "w": 5943600,
          "h": 457200,
          "fontName": "Sarabun",
          "fontSizePt": 30,
          "color": "#24333D",
          "bold": true,
          "italic": false,
          "align": "left",
          "value": "Digits 6 to 10"
        },
        {
          "id": "thai",
          "kind": "text",
          "x": 1142988.0,
          "y": 2332605.0,
          "w": 5303400.0,
          "h": 1042060.0,
          "fontName": "Sarabun",
          "fontSizePt": 32,
          "color": "#24333D",
          "bold": true,
          "italic": false,
          "align": "left",
          "value": "หก (hòk)",
          "segments": [
            {
              "text": "หก",
              "fontName": "Sarabun",
              "fontSizePt": 32.0,
              "color": "#24333D",
              "bold": true,
              "italic": false
            },
            {
              "text": " (hòk)",
              "fontName": "Sarabun",
              "fontSizePt": 19.8,
              "color": "#566873",
              "bold": false,
              "italic": true
            }
          ]
        },
        {
          "id": "english",
          "kind": "text",
          "x": 1143000,
          "y": 3374675,
          "w": 5303400,
          "h": 365700,
          "fontName": "Sarabun",
          "fontSizePt": 15,
          "color": "#82909A",
          "bold": false,
          "italic": false,
          "align": "left",
          "value": "six"
        },
        {
          "id": "note",
          "kind": "text",
          "x": 731520,
          "y": 4142240,
          "w": 6858000,
          "h": 914400,
          "fontName": "Sarabun",
          "fontSizePt": 16,
          "color": "#24333D",
          "bold": false,
          "italic": false,
          "align": "left",
          "value": "หก | hòk | 6 — six\nเจ็ด | jèt | 7 — seven"
        }
      ]
    },
    {
      "id": "canva-slide-05",
      "title": "Ask what number and say your age",
      "layoutFamily": "drill-rows",
      "backgroundPath": "canva-backgrounds/slide-05.png",
      "elements": [
        {
          "id": "section_label",
          "kind": "text",
          "x": 731527,
          "y": 642588,
          "w": 1210500,
          "h": 320100,